{
  "$schema": "../schema.json",
  "name": "Keyboard",
  "realms": ["menu", "client"],
  "description": "API for interacting with the keyboard.",
  "enums": [
    {
      "name": "Key",
      "description": "Keyboard keys.",
      "values": [
        "Space",
        "Apostrophe",
        "Comma",
        "Minus",
        "FullStop",
        "ForwardSlash",
        "Zero",
        "One",
        "Two",
        "Three",
        "Four",
        "Five",
        "Six",
        "Seven",
        "Eight",
        "Nine",
        "Semicolon",
        "Equal",
        "A",
        "B",
        "C",
        "D",
        "E",
        "F",
        "G",
        "H",
        "I",
        "J",
        "K",
        "L",
        "M",
        "N",
        "O",
        "P",
        "Q",
        "R",
        "S",
        "T",
        "U",
        "V",
        "W",
        "X",
        "Y",
        "Z",
        "LeftSquareBracket",
        "BackSlash",
        "RightSquareBracket",
        "Grave",
        "World1",
        "World2",
        "Escape",
        "Enter",
        "Tab",
        "Backspace",
        "Insert",
        "Delete",
        "Right",
        "Left",
        "Down",
        "Up",
        "PageUp",
        "PageDown",
        "Home",
        "End",
        "CapsLock",
        "ScrollLock",
        "NumLock",
        "PrintScreen",
        "Pause",
        "F1",
        "F2",
        "F3",
        "F4",
        "F5",
        "F6",
        "F7",
        "F8",
        "F9",
        "F10",
        "F11",
        "F12",
        "F13",
        "F14",
        "F15",
        "F16",
        "F17",
        "F18",
        "F19",
        "F20",
        "F21",
        "F22",
        "F23",
        "F24",
        "F25",
        "Numpad0",
        "Numpad1",
        "Numpad2",
        "Numpad3",
        "Numpad4",
        "Numpad5",
        "Numpad6",
        "Numpad7",
        "Numpad8",
        "Numpad9",
        "NumpadDecimal",
        "NumpadDivide",
        "NumpadMultiply",
        "NumpadSubtract",
        "NumpadAdd",
        "NumpadEnter",
        "NumpadEqual",
        "LeftShift",
        "LeftControl",
        "LeftAlt",
        "LeftSuper",
        "RightShift",
        "RightControl",
        "RightAlt",
        "RightSuper",
        "Menu"
      ]
    }
  ]
}
