{
  "$schema": "../schema.json",
  "name": "MoonJuice",
  "realms": ["menu", "client", "server"],
  "description": [
    "Library for TASBox's custom scripting language that transpiles to Lua.",
    "",
    "In most cases you won't need to use this, as the Luau library automatically transpiles MoonJuice scripts ending in `.mj`."
  ],
  "functions": [
    {
      "name": "toLuau",
      "description": "Transpiles the provided MoonJuice source code to Luau, returning the first syntax error if any.",
      "parameters": [
        {
          "name": "source",
          "description": "MoonJuice source code.",
          "type": "string"
        },
        {
          "name": "path",
          "description": "Path to the source file for formatting errors.",
          "type": "string"
        }
      ],
      "returns": [
        {
          "name": "transpiledSource",
          "description": "Transpiled Luau source code. Empty string if there were errors.",
          "type": "string"
        },
        {
          "name": "syntaxError",
          "description": "The first syntax error hit while transpiling, or `nil` if the source is valid.",
          "type": "string",
          "optional": true
        }
      ]
    }
  ]
}
